"id","relacionados","name","description","precio","imagen","categorias","linkPago","subcategorias"
5128,"[]","PICADORA DE CARNE MANUAL N°8","COD OR: 54261  -   COD WEB: 54261 La moledora de carne N°8 manual es una herramienta esencial para cualquier cocina que busca frescura y calidad en sus preparaciones.  Fabricada en metal resistente, esta moledora ofrece durabilidad y un rendimiento eficiente, permitiendo moler carne de manera rápida y uniforme.  Su diseño manual facilita el control sobre el proceso de molienda, ideal para preparar hamburguesas, salchicas y otros platos a base de carne.  Dimensiones: Ancho 15cm, Profundidad 10cm y Alto 23cm.","900.00","https://nuve-s3-dev.s3.amazonaws.com/media/public/product_images/PICADORA_DE_CARNE_MANUAL_N%C2%B08_3e896d44-b8db-11f0-8a22-0242ac110002/3e8783ee-b8db-11f0-8a22-0242ac110002.jpg","Hogar","",""
5127,"[]","MANIJA AGARRA BOLSAS","COD OR: (-)  -   COD WEB:  1025 MANIJA AGARRA BOLSAS ONE TRIP GRIP SIN ELECCION DE COLOR - Este gancho sujeta bolsas sirve para transportar bolsas de compras (y otros) con facilidad y sin lastimarse las manos - Posee un agarre con silicona suave excelente para que sea cómodo aunque lleve peso. - Transporte bolsas de la compra, baldes, perchas con ropa, etc - Lleve sus bolsas desde el coche a la cocina facilmente! - Dimensiones: 15 x 12 cm","127.50","https://nuve-s3-dev.s3.amazonaws.com/media/public/product_images/MANIJA_AGARRA_BOLSAS_01b8ff52-b691-11f0-a543-0242ac110002/01b6f644-b691-11f0-a543-0242ac110002.jpg","Hogar","",""
5126,"[]","MACERADOR PARA COCKTAIL","COD OR: 4876  -   COD WEB: 4876 Presentamos el macerador de acero inoxidable para bebidas y cocina, la herramienta perfecta para los amantes de los cócteles y la cocina. Con un diseño elegante y un sofisticado, este producto es un complemento esencial para cualquier cocina o bar. Este macerador y punzón está hecho de acero inoxidable de alta calidad, lo que garantiza durabilidad y resistencia. Es perfecto para preparar tu caipirinha favorita, triturando eficientemente el limón y el azúcar para liberar todos los sabores. Además, también se puede usar en la cocina para triturar ajo, hierbas y especias, lo que la convierte en una herramienta versátil. Con una unidad por paquete, este macerador y punzón es fácil de manejar y limpiar. Su tamaño compacto permite guardarlo fácilmente en cualquier espacio, lo que lo hace cómodo para el uso diario. Además, su diseño ergonómico garantiza un manejo cómodo, lo que le permite preparar sus bebidas y platos favoritos con facilidad. Agregue este macerador y ponche de caipirinha de acero inoxidable para bebidas y cocina a su juego de utensilios de cocina y bar. No solo mejorará tu experiencia de preparación de alimentos y bebidas, sino que también añadirá un toque de elegancia a tu espacio. No pierdas la oportunidad de tener esta increíble herramienta. Utensilio indispensable para el verano!  - Excelente calidad  - 22cm  - Acero inoxidable  - Fácil de manejar y limpiar","180.00","https://nuve-s3-dev.s3.amazonaws.com/media/public/product_images/MACERADOR_PARA_COCKTAIL_5bac4f88-b690-11f0-8a22-0242ac110002/5baa494a-b690-11f0-8a22-0242ac110002.jpg","Hogar","",""
5125,"[]","KIT ELEVADOR DE MUEBLES Y ELECTRODOMESTICOS","COD OR: 59442  -   COD WEB:  59442 Kit Elevador de Muebles Transportador Con Ruedas y Palanca Transforme la forma en que se mueven y elevan los muebles con el ELEVADOR DE MUEBLES Transportador Con Ruedas y Palanca.  Este producto es ideal para quienes buscan hacer más fácil el traslado de objetos pesados, optimizando el tiempo y el esfuerzo en cada movimiento.  Su diseño industrial, combinado con un diámetro de 19,05 pulgadas, garantiza una capacidad máxima de carga de 150 kg, perfectas para muebles y otros artículos voluminosos. Equipado con ruedas giratorias, el elevador permite un movimiento ágil y eficiente en cualquier superficie, sin complicaciones. A pesar de no contar con frenos, su construcción robusta asegura estabilidad durante el uso.  Este dispositivo es una solución indispensable para aquellos que buscan simplificar las tareas de levantamiento y transporte en el hogar o en entornos laborales. Descubra cómo este elevador puede facilitar su vida diaria, haciéndola más ligera y llevadera. Ideal tanto para profesionales de mudanzas como para usuarios domésticos que desean realizar cambios en su espacio sin esfuerzo.","412.50","https://nuve-s3-dev.s3.amazonaws.com/media/public/product_images/KIT_ELEVADOR_DE_MUEBLES_Y_ELECTRODOMESTICOS_9045d46c-b5b9-11f0-b82f-0242ac110002/9043db8a-b5b9-11f0-b82f-0242ac110002.jpg","Hogar","",""
5124,"[]","CONO SOPORTE PARA PAPAS FRITAS","COD OR: B2760     -    COD WEB: 2760 10X15CM Duradero de usar: este soporte para papas fritas está hecho de alambre de hierro y chapado fino. Acabado con proceso de refuerzo de soldadura, soporte estable, fuerte y duradero de usar, larga vida útil. Soporte de diseño de cono: soporte de diseño de cono, soporte estable, el soporte de papas fritas es lindo y de moda, uso perfecto para almacenar papas fritas, filete de pollo, helado, gofres y crepes. Con taza colgable: viene con taza colgable, se usa para colocar salsa y aperitivos, funciona perfectamente con el soporte y sirve bien a sus invitados. Se puede colgar en la canasta, es más conveniente disfrutar de comida deliciosa. Amplia aplicación: con exquisita mano de obra y aspecto hermoso, uso perfecto para desayuno familiar y cena, también para restaurante, cafetería, boda, fiesta y todo el festival. Un buen regalo: el diseño simple de cono en espiral está lleno de estilo simple y moderno. Vale la pena comprar un cono de soporte de papas fritas tan imprescindibles, es un bonito para tu familia y amigos.","240.00","https://nuve-s3-dev.s3.amazonaws.com/media/public/product_images/CONO_SOPORTE_PARA_PAPAS_FRITAS_d0fd28d0-b4ff-11f0-9a4d-0242ac110002/d0fb3886-b4ff-11f0-9a4d-0242ac110002.jpg","Hogar","",""
5123,"[]","DESTAPADOR PREMIUM DE CERVEZA","COD OR:  E3388  -   COD WEB: 3388 Mango grande, fácil de usar. La longitud de este mango aumenta el apalancamiento de la tapa, ayudándole a abrir las tapas más obstinadas con facilidad y estilo Alta calidad: larga vida útil gracias a la fuerte estructura de aleación de zinc, fácil de limpiar y no se oxidará. Superficies lisas y plata con elegancia trae más comodidad Aplicación: Pueden ser una gran herramienta para fiestas, bodas, festivales, bares, restaurantes, hoteles, casas, etc. Navidad perfecta, Pascua, cumpleaños, regalo de Halloween Uso: cada llavero de la botella de cerveza tiene un diseño profesional de dientes de botella, solo necesita alinear sus dientes con la tapa de la botella y levantarlo Al instante, puede abrir fácilmente varios tamaños de tapas de botella. Conveniente y rápido Utensilio indispensable para el hogar!  - Excelente calidad  - 17cm  - Acero inoxidable","202.50","https://nuve-s3-dev.s3.amazonaws.com/media/public/product_images/DESTAPADOR_PREMIUM_DE_CERVEZA_6b6f502e-b4ff-11f0-9a4d-0242ac110002/6b6d709c-b4ff-11f0-9a4d-0242ac110002.jpg","Hogar","",""
5122,"[]","ROMPE NUECES","COD OR: E4289  -   COD WEB: 4289 PINZA CASCANUECES DE LUJO CON MANGO DE SILICON ANTIDESLIZANTE. Con la aleación de Zinc de alta calidad, se garantiza que el cascanueces no se doblará, oxidará o dañará durante su uso. -Material: Acero Inoxidable -Diseño apalancado, fácil de usar y que ahorra mano de obra. Superficie lisa, antideslizante, cómoda y duradera. -Fractura sin esfuerzo Alimentos de diferentes tamaños debido a dos rebajes de diferentes tamaños, evitando que se deslice a través de los rebajes finamente ranurados -Estructura robusta y material de alta calidad, no se romperá ni deformará en el uso diario -El mango de silicona antideslizante se sostiene mejor que el mango completamente de metal. La estructura de embudo evita la caída de las nueces. - Se puede abrir fácilmente Mix-nut, Mid-nut y Max-nut. Eficiente tanto para nueces y frutos secos como para abrir botellas. -Adecuado para la mayoría de nueces simples, castañas, avellanas, macadamias, almendras y para nueces de Brasil, etc.","202.50","https://nuve-s3-dev.s3.amazonaws.com/media/public/product_images/ROMPE_NUECES_9621a852-b438-11f0-b82f-0242ac110002/961f9aa8-b438-11f0-b82f-0242ac110002.jpg","Hogar","",""
5121,"[]","CUCHARA METALICA HELADO","COD OR: E3389  -   COD WEB: 3389 Práctica Cuchara bochera para helados, muffins y cookies. Esta hecha de acero inoxidable de excelente calidad. Medidas: 18cm","202.50","https://nuve-s3-dev.s3.amazonaws.com/media/public/product_images/CUCHARA_METALICA_HELADO_38140480-b438-11f0-b82f-0242ac110002/38120450-b438-11f0-b82f-0242ac110002.jpg","Hogar","",""
5120,"[]","LAMPARA LED FLEXIBLE PORTATIL","COD OR:  54262 -  COD WEB: 54262 El Velador Led Flexible A Pilas' es un mini velador LED flexible con botón de encendido y apagado, ideal para cualquier espacio. Con una longitud de 25 cm, es portátil y fácil de colocar gracias a su base firme. Utiliza tecnología de iluminación LED, garantizando una luz brillante y eficiente. Fabricado con una estructura de plástico y aluminio, combina durabilidad y ligereza. Su pantalla de luz LED proporciona una iluminación clara y constante. Perfecto para quienes buscan una solución de iluminación práctica y moderna, este velador es nuevo y de alta calidad. SIN ELECCIÓN DE COLOR","135.00","https://nuve-s3-dev.s3.amazonaws.com/media/public/product_images/LAMPARA_LED_FLEXIBLE_PORTATIL_670688c2-b36a-11f0-866f-0242ac110002/6704a2f0-b36a-11f0-866f-0242ac110002.jpg","Hogar","",""
5119,"[]","SET DE 4 MOLDES PARA TORTAS POSTRES","COD OR: B2825   -    COD WEB: 2825 Este Molde Para Postres Anillos Para Hornear Mini Pastel es perfecto para la repostería. Fabricado en acero inoxidable, este molde redondo es apto para lavavajillas. Con capacidad para varios mini pasteles, es ideal para crear deliciosos postres de forma rápida y sencilla. Añade este práctico utensilio de cocina a tu colección y sorprende a tus invitados con exquisitos postres caseros.","217.50","https://nuve-s3-dev.s3.amazonaws.com/media/public/product_images/SET_DE_4_MOLDES_PARA_TORTAS_POSTRES_d6ea02f0-b369-11f0-b82f-0242ac110002/d6e7e02e-b369-11f0-b82f-0242ac110002.jpg","Hogar","",""
1281,"[]","BALDE FLUIR 12 LT - GRIS","BALDE PLASTICO 12 LITROS. MEDIDAS: 30cm ALTURA x 32cm DIAMETRO. LIBRE DE BPA. - SKU: 7896042014272","225.00","https://nuve-s3-dev.s3.amazonaws.com/media/public/product_images/BALDE_FLUIR_12_LT_-_GRIS_43270e3a-f054-11ed-83a5-0242ac110002/7896042014272.jpg","Hogar","",""
1280,"[]","BALDE DEC. 12 LT DECORA LAVANDERIA M - MENTA","BALDE PARA LIMPIEZA DISEÑO LAVANDERIA COLOR VERDE MENTA. CAPACIDAD: 12 LT. DIMENSIONES: 20CM DIAMETRO * 30CM ALTO. MATERIAL: POLIPROPILENO.  LIBRE DE BPA. - SKU: 7896042044019","300.00","https://nuve-s3-dev.s3.amazonaws.com/media/public/product_images/BALDE_DEC._12_LT_DECORA_LAVANDERIA_M_-_MENTA_421e647a-f054-11ed-83a5-0242ac110002/7896042044019.jpg","Hogar","",""
5118,"[]","VENTILADOR TURBO 30CM","COD OR: CUO6011  -   COD WEB:  6011 Aire limpio y fresco en tus ambientes!  - 51cm de diámetro  - 90W  - 5 aspas  - 3 Velocidades  - Modelo ""Chello"" Cuori  - Timer 1 hora","1875.00","https://nuve-s3-dev.s3.amazonaws.com/media/public/product_images/VENTILADOR_TURBO_30CM_5248c41c-b041-11f0-b82f-0242ac110002/524710fe-b041-11f0-b82f-0242ac110002.jpg","Hogar","",""
5117,"[]","VENTILADOR DE PIE 16 PULGADAS","COD OR: CUO6026G   -   COD WEB: 6026 Aire limpio y fresco en tus ambientes!  - 41cm de diámetro de rejilla  - 50W  - Hélice de 7 aspas  - 3 velocidades  - Altura regulable  - Base circular  - Modelo ""Bora"" Cuori","2550.00","https://nuve-s3-dev.s3.amazonaws.com/media/public/product_images/VENTILADOR_DE_PIE_16_PULGADAS_10f7b4c8-b041-11f0-b82f-0242ac110002/10f5e4f4-b041-11f0-b82f-0242ac110002.jpg","Hogar","",""
5116,"[]","SET X 3 TORTERAS DESMONTABLES","COD OR:  (-)  -    COD WEB: 1379 Cocción uniforme y fácil desmoldeo!  - Teflón  Práctico juego de moldes redondos desmontables Con las medidas más utilizadas en la repostería Antiadherentes Base con textura Con medidas de 24 26 28 centímetros de diámetro Tiene un altura de 6.5 centímetros","585.00","https://nuve-s3-dev.s3.amazonaws.com/media/public/product_images/SET_X_3_TORTERAS_DESMONTABLES_ac659f14-af7a-11f0-b82f-0242ac110002/ac63ce3c-af7a-11f0-b82f-0242ac110002.jpg","Hogar","",""
5115,"[]","SET DE JARRA + VASOS","COD OR: V1449  -   COD WEB:  1449 Ideal para uso diario en el hogar!  - Vidrio decorado  - 6 vasos de 250ml  - Jarra de 1.5lts  - Varios modelos, sin elección","690.00","https://nuve-s3-dev.s3.amazonaws.com/media/public/product_images/SET_DE_JARRA_%2B_VASOS_efbdff80-aeae-11f0-acbc-0242ac110002/efbbb23e-aeae-11f0-acbc-0242ac110002.jpg","Hogar","",""
5114,"[]","JUEGO TÉ PORCELANA 12 PZAS","COD OR: 11438  -   COD WEB: 11438 Ideal para juntadas en casa!  - 6 Platos  - 6 tazas  - Varios modelos, sin elección  - 12cm diámetro (plato)  - 8cm diámetro x 8,5 cm altura (taza)","675.00","https://nuve-s3-dev.s3.amazonaws.com/media/public/product_images/JUEGO_T%C3%89_PORCELANA_12_PZAS_7696515e-aeac-11f0-9634-0242ac110002/76945598-aeac-11f0-9634-0242ac110002.jpg","Hogar","",""
5113,"[]","LIMPIADOR FACIAL EXFOLIANTE","COD OR: 6135701    -    COD WEB: 6135701 Ideal para eliminar fácilmente las impurezas de la piel!  Cepillo exfoliante de medusa, limpiador facial exfoliante, cepillo de masaje, cepillo de limpieza profunda de poros. Dígale adiós por completo a usar sus manos para lavarse la cara, muy suave y cómodo. Puede estimular los poros de la piel, por lo que limpia más en profundidad. Cepillo de limpieza de silicona suave para eliminar fácilmente las impurezas de la piel. También puede usar sus tentáculos para masajear, después del lavado para relajarse bajo el masaje. - Silicona suave  - Cepilla y masajea  - 5,3x5x4cm  - Sin elección de color","67.50","https://nuve-s3-dev.s3.amazonaws.com/media/public/product_images/LIMPIADOR_FACIAL_EXFOLIANTE_63da498c-addd-11f0-acbc-0242ac110002/63d84574-addd-11f0-acbc-0242ac110002.jpg","Hogar","",""
2723,"[]","PALETA RICKY ZOOM AZUL","SKU: 7730784125226 SET DE 2 PALETAS + PELOTA, PARA JUGAR TODO EL VERANO! MEDIDA PALETA: 38*24CM, PELOTA: 4CM DIAMETRO. MATERIAL MADERA.","225.00","https://nuve-s3-dev.s3.amazonaws.com/media/public/product_images/PALETA_RICKY_ZOOM_AZUL_af0e5a2e-743c-11ee-9da4-0242ac110002/7730784125226.JPG","Infantil","",""
2716,"[]","PALETA BLUES CLUES","SKU: 7730784138264 SET DE 2 PALETAS + PELOTA, PARA JUGAR TODO EL VERANO! MEDIDA PALETA: 38*24CM, PELOTA: 4CM DIAMETRO. MATERIAL MADERA.","225.00","https://nuve-s3-dev.s3.amazonaws.com/media/public/product_images/PALETA_BLUES_CLUES_ae3d443e-743c-11ee-9da4-0242ac110002/7730784138264.JPG","Infantil","",""
2637,"[2643]","DEPORTE PLAYA TABLA MOREY 66 CM NEW BABY SHARK","SKU: 7730784118457 TABLA MOREY IDEAL PARA LA PLAYA O PISCINA - MATERIAL SUPERFICIE SUP: POLIESTER, RELLENO: EPS Y SUPERFICIE INFERIOR: PE - TAMAÑO: 66x45x5cm.","600.00","https://nuve-s3-dev.s3.amazonaws.com/media/public/product_images/DEPORTE_PLAYA_TABLA_MOREY_66_CM_NEW_BABY_SHARK_882b953e-743c-11ee-b848-0242ac110002/7730784118457.JPG","Infantil","",""
2643,"[2637]","DEPORTE PLAYA TABLA MOREY 66 CM PRINCESAS","SKU: 7730784046569 TABLA MOREY IDEAL PARA LA PLAYA O PISCINA - MATERIAL SUPERFICIE SUP: POLIESTER, RELLENO: EPS Y SUPERFICIE INFERIOR: PE - TAMAÑO: 66x45x5cm.","600.00","https://nuve-s3-dev.s3.amazonaws.com/media/public/product_images/DEPORTE_PLAYA_TABLA_MOREY_66_CM_PRINCESAS_88db4b78-743c-11ee-b848-0242ac110002/7730784046569.JPG","Infantil","",""
5096,"[]","PALOTE 42CM MOVIL MADERA","COD OR:  60147   -    COD WEB: 60147 Largo del mango: 42 cm. Largo total: 24 cm. Diámetro: 5 cm. Diseño de palo de amasar: palote. Fabricado en madera. Material del mango: madera. Es giratorio.","225.00","https://nuve-s3-dev.s3.amazonaws.com/media/public/product_images/PALOTE_42CM_MOVIL_MADERA_98d980b8-9d6a-11f0-8362-0242ac110002/98d7a84c-9d6a-11f0-8362-0242ac110002.jpg","Hogar","",""
5112,"[]","ORGANIZADOR DE ESCRITORIO","COD OR:  6133601   -    COD WEB: 6133601 Organizador de escritorio Organizador con 4 divisiones para organizar lápices, lapiceras, ganchitos, tijeras y demás artículos de escritorio. También es ideal para organizar maquillaje. Medidas: Alto: 9,5 cm Ancho: 15 cm Profundidad: 9,5 cm Uso: Escritorio","210.00","https://nuve-s3-dev.s3.amazonaws.com/media/public/product_images/ORGANIZADOR_DE_ESCRITORIO_dc12fa8e-aabd-11f0-bdc9-0242ac110002/dc10df1a-aabd-11f0-bdc9-0242ac110002.jpg","Hogar","",""
5111,"[]","PROTECTOR DE PUERTA AJUSTABLE","COD OR:  VD80P  -   COD WEB: 80  Descripción Aislamiento durante todo el año: mantente caliente durante los meses de invierno y fresco durante los meses de verano con prácticos protectores de corrientes de aire. Se desliza debajo de ventanas o puertas para evitar que el aire frío entre o escape de aire frío del aire acondicionado. Hecho de una cubierta de tela duradera, la funda sostiene cilindros de espuma en los lados opuestos de una puerta o ventana para crear un sellado hermético. Ideal para puertas y ventanas: estos topes se pueden utilizar debajo de puertas y ventanas. Son de doble cara, lo que permite una protección adicional contra el frío o el calor dependiendo de la temporada. Cuentan con un cierre de velcro que es ajustable, por lo que puedes ajustarlos fácilmente al ajuste adecuado para tu hogar. Protegerán el interior de tu hogar o negocio de temperaturas frías y calientes, para que puedas disfrutar de los interiores. Ayudará a reducir el ruido exterior o evitar que la suciedad, el polvo o los insectos entren en tu hogar. Aislamiento que necesita: estos topes de puerta fáciles de instalar son lo suficientemente flexibles para usar en cualquier tipo de suelo, incluyendo alfombras, azulejos, linóleo y maderas duras y se ajustan de forma segura debajo de puertas. Utiliza estos topes de ventana y puerta en tus principales áreas de vida, sótanos y garajes. Medida: 80cm de largo","225.00","https://nuve-s3-dev.s3.amazonaws.com/media/public/product_images/PROTECTOR_DE_PUERTA_AJUSTABLE_33db2774-aabd-11f0-acbc-0242ac110002/33d905b6-aabd-11f0-acbc-0242ac110002.jpg","Hogar","",""
5110,"[]","PRENSA PARA VEGETALES","COD OR: 10060  -   COD WEB:  10060 Convierte fácilmente las patatas en un puré suave con esta prensa de patatas manual. Ahorra tiempo y esfuerzo en la cocina. Fabricada con material ABS duradero, esta prensa de patatas ofrece un agarre cómodo y un funcionamiento sencillo. Perfecta para amas de casa, entusiastas de la cocina y profesionales de la industria que necesitan hacer puré de patatas con frecuencia. Adecuada para diversos entornos, como cocinas domésticas, restaurantes y cantinas.  Ideal para hacer puré de patatas, ensaladas de patatas y mucho más. Mejora tu experiencia culinaria con esta versátil prensa de patatas. Crea platos impresionantes y disfruta siempre de un puré de patatas perfecto. Especificaciones: Material: ABS - Agarre cómodo  - 3 discos de acero inoxidable   - Abertura de 8/9 cm de diámetro","300.00","https://nuve-s3-dev.s3.amazonaws.com/media/public/product_images/PRENSA_PARA_VEGETALES_2f3f09c4-a9fa-11f0-acbc-0242ac110002/2f3d14e8-a9fa-11f0-acbc-0242ac110002.jpg","Hogar","",""
5109,"[]","JUEGO DE JARRA Y VASOS","COD OR: FE-AB61  -   COD WEB: 61 Jarra De Vidrio De 1.3l Con Tapa Y 4 Vasos Largos  Clásico set de Jarra de Vidrio con 4 vasos, perfecto para servir agua, jugos o refrescos.  La jarra de 1.3 litros incluye tapa y asa fabricada en plástico, tanto su cuerpo como los 4 vasos están fabricado en vidrio de alta resistencia.  Este práctico set, es muy útil para utilizar en el hogar o en la oficina. · Capacidad de 1.3 litros · Vidrio resistente · Incluye 4 vasos de 350ml · Fácil de lavar Sin elección de color","525.00","https://nuve-s3-dev.s3.amazonaws.com/media/public/product_images/JUEGO_DE_JARRA_Y_VASOS_eefdeb82-a9f9-11f0-9634-0242ac110002/eefba200-a9f9-11f0-9634-0242ac110002.jpg","Hogar","",""
2862,"[]","INFLABLE COLCHON 69*183 MATTE COLORES SURTIDOS","SKU: 6942138940480 COLCHON INFLABLE CON ALMOHADAS DE 2 CAMARAS - MEDIDA: 69x183cm - FABRICADO EN VINILO RESISTENTE - VALVULA DE SEGURIDAD.","261.75","https://nuve-s3-dev.s3.amazonaws.com/media/public/product_images/INFLABLE_COLCHON_69*183_MATTE_COLORES_SURTIDOS_92c40752-79b3-11ee-ae64-0242ac110002/6942138940480_1.jpg","Infantil","",""
2861,"[]","INFLABLE COLCHON 56*84 CM EST FRUTAS COLOR SURTIDOS","SKU: 6942138967746 COLCHON INFLABLE CON TEMATICAS FRUTAS - IDEAL PARA NIÑOS DE 3 A 8 AÑOS - RESISTE HASTA 45Kg - MEDIDAS: 56x84cm.","337.50","https://nuve-s3-dev.s3.amazonaws.com/media/public/product_images/INFLABLE_COLCHON_56*84_CM_EST_FRUTAS_COLOR_SURTIDOS_92321f7c-79b3-11ee-ae64-0242ac110002/6942138967746_1.jpg","Infantil","",""
2860,"[]","INFLABLE COLCHON 48*120 C/CAJA MINNIE","SKU: 7730784050368 ""COLCHON INFLABLE MEDIDAS: 48x120cm -  ¡IDEAL PARA ESTAR EN LA PISCINA!""","134.25","https://nuve-s3-dev.s3.amazonaws.com/media/public/product_images/INFLABLE_COLCHON_48*120_C/CAJA_MINNIE_920e4bc4-79b3-11ee-ae64-0242ac110002/7730784050368.jpg","Infantil","",""
5107,"[5046]","ASADERA RECTANGULAR HONDA","COD OR: CB003256M  -   COD WEB: 003256 Asadera rectangular Corrina 37,5 x 25,3 cm honda – Antiadherente Premium Ideal para cocinar carnes, pastas al horno, vegetales, lasañas o postres. Fabricada en Chapa galvanizada con teflón antiadherente premium, garantiza una cocción uniforme y un fácil desmolde sin que los alimentos se peguen. Su diseño hondo permite preparar comidas abundantes y jugosas. Características: Medidas: 37,5 x 25,3 cm (modelo hondo) Material: Chapa galvanizada con teflón antiadherente premium Marca: Corrina Housewares Fácil de limpiar Fácil de desmoldar Ideal para horno Perfecta para uso diario o para quienes disfrutan cocinar con comodidad y resultados profesionales.","480.00","https://nuve-s3-dev.s3.amazonaws.com/media/public/product_images/ASADERA_RECTANGULAR_HONDA_b7264ac8-a86f-11f0-acbc-0242ac110002/b72469f6-a86f-11f0-acbc-0242ac110002.jpg","Hogar","",""
5106,"[]","BUDINERA REDONDA CON TUBO","COD OR: CB00349  -  COD WEB: 00349 Budinera Redonda con Tubo Corrina Housewares 24x21x4 cm Prepará budines, tortas o flanes perfectos con esta budinera Corrina Housewares, diseñada para lograr una cocción pareja y un desmolde sin esfuerzo. Características: Medidas: 24 x 21 x 4 cm Material: Chapa galvanizada con teflón antiadherente premium Fácil de limpiar y desmoldar Ideal para horno Distribuye el calor de forma uniforme Apta para preparar budines, flanes, tortas, bizcochuelos y más Su diseño con tubo central permite que el calor circule mejor, garantizando una cocción uniforme en el centro del postre.","412.50","https://nuve-s3-dev.s3.amazonaws.com/media/public/product_images/BUDINERA_REDONDA_CON_TUBO_e14e22ae-a86e-11f0-bdc9-0242ac110002/e14bfa74-a86e-11f0-bdc9-0242ac110002.jpg","Hogar","",""
5105,"[]","JUEGO ASADO 3 PZAS PARRILLA","COD OR:  (-)  -  COD WEB: 10704 Set De Asado Parrilla Juego Asador Parrillero X 3 Piezas Set para asado, ideal para regalo y uso doméstico. ESPECIFICACIONES * Medidas - Largo: 34/5 cm * Cantidad de piezas: 3 (Espatula, pinza y tenedor) * Material: Mango de madera y acero","547.50","https://nuve-s3-dev.s3.amazonaws.com/media/public/product_images/JUEGO_ASADO_3_PZAS_PARRILLA_9bad2e7c-a547-11f0-bdc9-0242ac110002/9baaad6e-a547-11f0-bdc9-0242ac110002.jpg","Hogar","",""
5104,"[]","PARRILLA PARA PESCADO","COD OR:  231   -    COD WEB: 231 Pinza para colocar el pescado y/o achuras y cocinarlos en la parrilla. La estructura es de acero, con mango de madera. Tiene un gancho que sujeta ambas mitades luego de colocar el alimento. La medida para colocar el alimento es de 36cmx16cm. La medida total es 57 cm de largo.","277.50","https://nuve-s3-dev.s3.amazonaws.com/media/public/product_images/PARRILLA_PARA_PESCADO_f8194c32-a546-11f0-acbc-0242ac110002/f8174108-a546-11f0-acbc-0242ac110002.jpg","Hogar","",""
5103,"[]","BANDEJA FUENTE OVAL","COD OR:  (-)   -  COD WEB: 13158 Ideal para servir alimentos!  Bandeja fuente oval de Acero inoxidable con grabado de círculos.  Medidas: 35x21cm.  Apta para horno","150.00","https://nuve-s3-dev.s3.amazonaws.com/media/public/product_images/BANDEJA_FUENTE_OVAL_795e7104-a476-11f0-acbc-0242ac110002/795c8024-a476-11f0-acbc-0242ac110002.jpg","Hogar","",""
5102,"[]","SET X6 HUEVERAS DE SILICONA","COD OR: 50610   -   COD WEB: 50610 Cocina deliciosos platillos con este Molde de Silicona para Hervir Huevos Ahora con estos nuevos moldes es mucho más fácil servir los huevos cocinados, tan solo rompes el huevo, lo viertes en el recipiente, tapas y a cocinar. Una vez esté listo lo sacas de la copa, quedará perfectamente formado, sin cáscara y listo para comer. Además puedes agregarle tus ingredientes favoritos como vegetales o embutidos, deliciosos huevos rellenos de forma fácil y rápido CARACTERISTICAS: Incluye 6 recipientes anti adherentes. Silicona  especialmente fabricada para alimentos. Libre de BPA y antiadherente Resistente al calor, no tóxico Medida de 1 molde 6.5 x 6.5 x 8.3cm Fácil de preparar huevos cocidos duros o blandos, huevos revueltos, mini tortillas, huevos Benedict y más. Una vez esté listo lo sacas de la copa, quedará perfectamente formado, sin cáscara y listo para comer. Tenga cuidado al manipular ya que los contenidos estarán muy calientes.","225.00","https://nuve-s3-dev.s3.amazonaws.com/media/public/product_images/SET_X6_HUEVERAS_DE_SILICONA_30adb628-a475-11f0-acbc-0242ac110002/30aba9b4-a475-11f0-acbc-0242ac110002.jpg","Hogar","",""
